Topic,"Title (for model laws include the word ""Model"" in title)",Short Title (only for Exemplary),Year (if unknown for Model look at effective date - use same year if July/prior year if January),Source,Source Website,State (multiple states separated by a comma) ,"Format (Model, Exemplary, Support)","Level (State, County, Municipal)","Type (Bill, Act/Ordinance, Executive Order, Referendum, Administrative Rule, Constitutional Amendment, Report, Other)",Web Folder Link to PDF,Web Folder Path to PDF,Web Folder Link to Word Doc,Summary,Bill Number,Web Folder Link to Bill PDF,Legislative History,Alternative Terms,(Internal Notes)
Local Permitting for Affordable Housing,1969 Massachusetts Chapter 774,,1969,Massachusetts Legislature,http://www.malegislature.gov/,Massachusetts,Exemplary,State,Act/Ordinance,http://www.BrandeisProject.org/Alice/Web_Folder/Economic_Security/Local_Permitting_for_Affordable_Housing/1969_Massachusetts_Chapter_774.pdf,,,This act allows for a limited override of local requirements and regulations when they are inconsistent with local and regional affordable housing needs. ,,,,,
Regional Tax Base Sharing,1971 Minnesota Extra Session Chapter 24,Charles R. Weaver Metropolitan Revenue Distribution Act,1971,Minnesota Legislature,http://www.leg.state.mn.us/,Minnesota,Exemplary,State,Other,http://www.BrandeisProject.org/Alice/Web_Folder/Revenue_And_Budget/Regional_Tax_Base_Sharing/1971_Minnesota_Extra_Session_Chapter_24.pdf,,,"An act to enable regional tax base sharing, which allows taxing entities within a metropolitan area to share revenue generated from new development; Sharing a tax base facilitates better land use and development patterns, allows for a better distribution of public services and reduces interregional competition for business and resources.",1971 First Special Session Minnesota Senate Bill 10,,,,https://www.revisor.mn.gov/statutes/?id=473F
Election Day Registration,1973 Minnesota Chapter 676,,1973,Minnesota legislature,http://www.leg.state.mn.us/,Minnesota,Exemplary,State,Act/Ordinance,http://www.BrandeisProject.org/Alice/Web_Folder/Voting_and_Elections/Election_Day_Registration/1973_Minnesota_Chapter_676.pdf,,,"This act authorizes any eligible voter to register on election day by completing a registration card, making an oath in the form prescribed by the commissioner and providing proof of his residence. An individual may prove his residence by (1) the showing of his drivers license or nonqualification certificate or (2) providing any document approved by the commissioner as proper identification, or C3) having an individual who is registered to vote in the precinct sign an oath in the presence of the election judge that he personally knows that the applicant is a resident of the precinct. Forms for the card and oath shall be available at each polling place.",,,,,
Unemployment Insurance Alternative Base Period,1987 Washington Chapter 278,,1987,Washington Legislature,http://www.leg.wa.gov/pages/home.aspx,Washington ,Exemplary,State,Act/Ordinance,http://www.BrandeisProject.org/Alice/Web_Folder/Economic_Security/Unemployment_Insurance_Alternative_Base_Period/1987_Washington_Chapter_278.pdf,,,This act allows the base year use for unemployment insurance to be computed using the last four completed calendar quarters immediately preceding the first day of the individual's benefit year instead of the first four completed calendar quarters within the last five years.,,,,,
Municipal Environmental Regulation,"1988 Jay Environmental Control and Improvement
Ordinance",,1988,Town of Jay City Council,http://townofjayfl.com/about.htm,Maine,Exemplary,Municipal ,Act/Ordinance,http://www.BrandeisProject.org/Alice/Web_Folder/Energy_and_Environment/Municipal_Environmental_Regulation/1988_Jay_Environmental_Control_And_Improvement_Ordinance.pdf,,,"The Jay Environmental Control and Improvement Ordinance is a comprehensive regulatory plan to protect and enhance the public health and environment of the Town of Jay and to prevent threats to health and the environment posed by the discharge of pollutants to air, water and land...The Ordinance prohibits certain activities that may adversely affect public health and the environment and regulates subdivisions, landfills, point source discharges into water and emissions of air contaminants through permits issued and enforced by the Planning Board.",,,,,
Housing Trust Funds,1989 Chicago Ordinance ,Establishment of Chicago Low Income Housing Trust Fund,1989,Chicago City Council ,https://www.cityofchicago.org/city/en/about/council.html,,Exemplary,Municipal,Act/Ordinance,http://www.BrandeisProject.org/Alice/Web_Folder/Economic_Security/Housing_Trust_Funds/1989_Chicago_Ordinance.pdf,,,This ordinance establishes a non profit corporation in the form of a trust fund to address the permanent housing needs of residents whose income is at or below 50% of the median income.,,,,,
Timber Supply Stabilization,Idaho Administrative Procedures Act 20 Title 2 Chapter 11,Timber Supply Stabilization Act of 1989,1989,Idaho Legislature,http://www.legislature.idaho.gov/,Idaho,Exemplary,State,Act/Ordinance,http://www.BrandeisProject.org/Alice/Web_Folder/Economic_and_Workforce_Development/Timber_Supply_Stabilization/Idaho_Administrative_Procedures_Act_20_Title_2_Chapter_11.pdf,,,"Under the Timber Supply Stabilization Act, 95 percent of Idaho’s state timber is offered to qualified bidders
 each year. A qualified bidder is essentially an Idaho processor – that 
is, she has historically processed at least 95 percent of state timber 
within the state, or has sold at least 95 percent of the timber to other
 in-state processors. The remaining five percent of state timber sales 
are open to all bidders. ",,http://www.ilsr.org/rule/in-state-processing-requirement/2161-2/,,"Economic Development, Workforce Development, ",
Big Box Retailing,1991 Greenfield Massachusetts Major Development Review Rules and Regulations for Impact Statements,,1991,Greenfield Planning Board,http://www.townofgreenfield.org/pages/greenfieldma_bcomm/planning/index,Massachusetts,Exemplary,Municipal,Administrative Rule,http://www.BrandeisProject.org/Alice/Web_Folder/Economic_and_Workforce_Development/Big_Box_Retailing/1991_Greenfield_Massachusetts_EIR_Rules_Regulations.pdf,,,"An rule which requires proposed retail stores to undergo a special review if they are to exceed 20,000 square feet or generate more than 500 vehicle trips per day. Impact studies are paid for by the developer and consider the project’s impact on traffic, municipal services, public revenue, the environment, the local economy, and the community. The community component includes potential impact on historic and scenic sites, the character of the town, and the downtown business district.  Findings of adverse impact may result in rejection of the development.",,,,"Zoning, Big Box Retail, Land Use Planning, Transportation, Impact Statement, Planned Urban Development, PUD",
Unemployment Insurance Coverage For Independent Contractors,1991 Washington Title 50 Chapter 4 Section 140,,1991,Washington Legislature,http://www.leg.wa.gov/pages/home.aspx,Washington ,Exemplary,State,Other,http://www.BrandeisProject.org/Alice/Web_Folder/Economic_Security/Unemployment_Insurance_Coverage_For_Independent_Contractors/1991_Washington_Title_50_Chapter_4_Section_140.pdf,,,"This legislation helps define the employer-employee relationship by determining if workers are independent contractors for access to unemployment insurance. Washington uses a more specific description than many states who use the “ABC” test, which excludes workers from UI coverage only if (A) they are free of the employer’s control in the performance of their job; (B) their service is outside the normal course of business of the employer or off of the employer’s premises; and (C) the worker operates his or her own business.",1991 Washington Title 50 Chapter 4 Section 140,,,,
Housing Trust Funds,1992 Pennsylvania Chapter 137,County Affordable Housing Funds Act,1992,Pennsylvania legislature,http://www.legis.state.pa.us/,,Exemplary,State,Act/Ordinance,http://www.BrandeisProject.org/Alice/Web_Folder/Economic_Security/Housing_Trust_Funds/1992_Pennsylvania_Chapter_137.pdf,,,"This act permits 66 of the state’s 67 counties (excluding Philadelphia) to raise additional revenues to be used for affordable housing needs by increasing fees for recording mortgages and deeds. This act requires that the additional funds be expended for any program or project approved by the county commissioners which increases the availability of quality housing, either sales or rental, to any county resident whose annual income is less than the median income of the county.",1992 Pennsylvania Senate Bill 962; http://www.legis.state.pa.us/cfdocs/legis/PN/Public/btCheck.cfm?txtType=HTM&sessYr=1991&sessInd=0&billBody=S&billTyp=B&billNbr=0962&pn=1033,,http://www.legis.state.pa.us/cfdocs/billInfo/bill_history.cfm?syear=1991&sind=0&body=S&type=B&bn=962,,
Corporate Tax Disclosure Requirements,Corporate Tax Policy and the Right to Know,,1993,The Fiscal Policy Institute,http://fiscalpolicy.org/,,Support,State,Report,http://www.BrandeisProject.org/Alice/Web_Folder/Revenue_And_Budget/Corporate_Tax_Disclosure_Requirements/1993_Corporate_Tax_Policy_and_the_Right_to_Know_Report.pdf,,,A report on the benefit of increased corporate tax reporting as well as increasing public reporting of corporate tax information.,,,,,
Time off for Children's Educational Activities,1994 California Chapter 1290,Family-School Partnership Act,1994,California State Assembly,http://assembly.ca.gov/,California,Exemplary,State,Act/Ordinance,http://www.BrandeisProject.org/Alice/Web_Folder/Labor_Rights_and_Protections/Time_Off_for_Childrens'_Educational_Activities/1994_California_Chapter_1290.pdf,,,"Requires employers with 25 or more employees to allow employees to use as much as 40 hours per school year in preexisting paid leave to attend their childrens' school activities, for custodial children in grades K-12.",1994 California Assembly Bill 2590,http://www.leginfo.ca.gov/pub/93-94/bill/asm/ab_2551-2600/ab_2590_bill_940126_introduced,http://www.leginfo.ca.gov/pub/93-94/bill/asm/ab_2551-2600/ab_2590_bill_history,Small Necessities Leave,http://www.cde.ca.gov/ls/pf/pf/laborcode.asp
Unemployment Insurance Alternative Base Period,1994 Washington Chapter 3,,1994,Washington Legislature,http://www.leg.wa.gov/pages/home.aspx,Washington ,Exemplary,State,Act/Ordinance,http://www.BrandeisProject.org/Alice/Web_Folder/Economic_Security/Unemployment_Insurance_Alternative_Base_Period/1994_Washington_Chapter_3.pdf,,,This act requires the Department of Labor to promptly contact employers to request assistance in obtaining wage information for the last completed calendar quarter if it has not been reported at the time of initial application for an unemployment insurance when using an alternative base wage.,1994 Washington Senate Bill 6073; http://apps.leg.wa.gov/documents/billdocs/1993-94/Pdf/Bills/Senate%20Bills/6073.pdf ,,http://dlr.leg.wa.gov/billsummary/default.aspx?year=1993&bill=6073,,
Big Box Retailing,1994 Fort Collins Ordinance 111,,1994,Fort Collins City Council,http://www.fcgov.com/council/,Colorado,Exemplary,Municipal,Act/Ordinance,http://www.BrandeisProject.org/Alice/Web_Folder/Economic_and_Workforce_Development/Big_Box_Retailing/1994_Fort_Collins_Colorado_Ordinance_111.pdf,,,"An ordinance adopting a six-month moratorium on development of stores larger than 80,000 square feet. The city used the time to review the design, transportation, and other planning issues posed by big box retailers, and to make changes to its planning and zoning rules.",,,,"Zoning, Big Box Retail, Land Use Planning, Transportation, Impact Statement, Planned Urban Development, PUD",
Anti-Strategic Lawsuits Against Public Participation (SLAPP),1994 Massachusetts Chapter 231 Section 59H,Strategic Litigation Against Public Participation; Special Motion to Dismiss,1994,Massachusetts Legislature,http://www.malegislature.gov/,Massachusetts,Exemplary,State,Other,http://www.BrandeisProject.org/Alice/Web_Folder/Civil_Rights/Anti-Strategic_Litigation_Against_Public_Participation/1994_Massachusetts_Chapter_231_Section_59H.pdf,http://www.BrandeisProject.org/Alice/Web_Folder/Civil_Rights/Anti-Strategic_Litigation_Against_Public_Participation/1994_Massachusetts_Chapter_231_Section_59H.pdf,,"This law restricts Strategic Lawsuits Against Public Participation. SLAPPs are cases by corporations against a party's exercise of its right of petition or of free speech, used to silence and harass critics by forcing them to spend money to defend these suits. In any case in which a SLAPP victim asserts that the civil claims against them are based on exercising of their right of petition under the constitution of the United States or of the commonwealth, the party may bring a special motion to dismiss.",,,,,
Lobbying Reform,1995 Alabama Chapter 95-194,,1995,Alabama legislature,http://www.legislature.state.al.us/,Alabama,Exemplary,State,Act/Ordinance,http://www.BrandeisProject.org/Alice/Web_Folder/Voting_and_Elections/Lobbying_Reform/1995_Alabama_Chapter_95-194.pdf,,,"This act prohibits: a public official or employee from serving for a fee as a lobbyist or otherwise represent clients including his or her employer before the board, agency, commission, department, or legislative body, of which he or she is a former member for a period of two years after he or she leaves such membership; certain public officials and administrators involved in purchasing or awarding of contracts, awards, or grants, among other things, from entering into, soliciting, or negotiating a contract, grant, or award with the governmental agency of which the person was a member or employee for a period of two years after he or she leaves the membership or employment of such governmental agency; certain public officials or employees who personally participate in the direct regulation, audit, or investigation of a private business, corporation, partnership, or individual within two years of his or her departure from such employment solicit or accept employment with such private business, corporation, partnership, or individual; and former public officials or public employees of the state may, within two years after termination of office or employment, act as attorney for any person other than himself or herself or the state, in connection with any judicial proceeding or other matter in which the state is a party.",,,,,
Transparent Rate Change Approval Process,1996 California Assembly Bill 2535,,1996,California Legislature,,California,Exemplary,State,Bill,http://www.BrandeisProject.org/Alice/Web_Folder/Health/Transparent_Rate_Change_Approval_Process/1996_California_Assembly_Bill_2535.pdf,,,"This bill would provide that, in any event, a rate change application is deemed approved 90 days after the rate application is received unless disapproved or extraordinary circumstances exist. It would make related changes. The bill would also provide that any application by an insurer for a rate change that results in a premium decrease shall be deemed approved 45 days after public notice unless during that time the commissioner finds the rate to be excessive, inadequate, unfairly discriminatory, or otherwise in violation of the laws regulating insurance rates
 .",1996 California Assembly Bill 2535,,http://www.consumerwatchdog.org/feature/text-proposition-103,,
Transit Oriented Development,1997 California Chapter 622,,1997,California Legislature,http://www.legislature.ca.gov/,California,Exemplary ,State,Act/Ordinance,http://www.BrandeisProject.org/Alice/Web_Folder/Infrastructure_and_Smart_Growth/Transit-Oriented_Development/1997_California_Chapter_622.pdf,,,"An Act to amend California's Streets and Highways Code, relating
to transportation.",1997 California Senate Bill 45,http://www.leginfo.ca.gov/pub/97-98/bill/sen/sb_0001-0050/sb_45_bill_19961202_introduced.pdf,http://info.sen.ca.gov/pub/97-98/bill/sen/sb_0001-0050/sb_45_bill_19971003_chaptered.html,"Mass Transit, Transit Oriented Development, Public Transportation",
Equalized School Funding,Vermont Act 60 of 1997,Equal Educational Opportunity Act of 1997,1997,Vermont Legislature,http://www.leg.state.vt.us/,Vermont,Exemplary,State,Act/Ordinance,http://www.BrandeisProject.org/Alice/Web_Folder/Education/Equalized_School_Funding/1997_Vermont_House_Bill_527.pdf,,,"Act 60 accomplishes its goal of educational equity by replacing dozens of widely varying local school tax rates with a single statewide property tax. In addition, the gasoline tax was raised by 4 cents a gallon to fund education",1997 Vermont House Bill 527,http://www.leg.state.vt.us/docs/legdoc.cfm?URL=/docs/1998/bills/intro/H-527.HTM,,"Property Tax, School Funding, Adequacy Based Funding",
Equalized School Funding,New Mexico Laws 1997 Chapter 32,,1997,New Mexico Legislature,http://www.nmlegis.gov/lcs/leg.aspx?T=R,New Mexico,Exemplary,State,Act/Ordinance,http://www.BrandeisProject.org/Alice/Web_Folder/Education/Equalized_School_Funding/1997_New_Mexico_Senate_Bill_100.pdf,,," In 1997 the legislature passed a revised school funding formula (S.B. 100), increasing the share of funds to around 84 percent and targeting more of these funds to at-risk students. Money raised in individual school districts may go towards construction and maintenance, but not for school operating costs.",1997 New Mexico Senate Bill 100,http://www.nmlegis.gov/Sessions/97%20Regular/bills/senate/SB0100.pdf,http://www.nmlegis.gov/lcs/_session.aspx?chamber=S&legtype=B&legno=100&year=97,"Property Tax, School Funding, Adequacy Based Funding, At-risk students, ",
PerformanceStat,1997 Louisiana Act 1465,The Louisiana Government Performance and Accountability Act,1997,Louisiana Legislature,http://www.legis.state.la.us/,Louisiana,Exemplary,State,Act/Ordinance,http://www.BrandeisProject.org/Alice/Web_Folder/Government_Performance/PerformanceStat/1997_Louisiana_Act_1465.pdf,,,An act to enable the use of a performance measurement system as part of the state budget process,1997 Louisiana House Bill 2476,http://legis.la.gov/leg_docs/97RS/CVT48/OUT/0000BSHW.PDF,,"StateStat, PerformanceStat, Performance Measurement, CompStat, CitiStat,",http://doa.louisiana.gov/OPB/pbb/enabling.htm
Time off for Children's Educational Activities,1997 Vermont Act 41,,1997,Vermont Legislature,http://www.leg.state.vt.us/,Vermont,Exemplary,State,Act/Ordinance,http://www.BrandeisProject.org/Alice/Web_Folder/Labor_Rights_and_Protections/Time_Off_for_Childrens'_Educational_Activities/1997_Vermont_Act_41.pdf,,,"Requires employers to allow employees to utilize already provided paid leave, or unpaid leave, to take time off work to attend their childrens' school activities.",1997 Vermont House Bill 192,http://www.leg.state.vt.us/DOCS/1998/BILLS/INTRO/H-192.HTM,,Small Necessities Leave,
Time off for Children's Educational Activities,1997 California Chapter 157,Amendment to Family-School Partnership Act,1997,California State Assembly,http://assembly.ca.gov/,California,Exemplary,State,Act/Ordinance,http://www.BrandeisProject.org/Alice/Web_Folder/Labor_Rights_and_Protections/Time_Off_for_Childrens'_Educational_Activities/1997_California_Chapter_157.pdf,,,Expands family-school partnership act to include activities for children in licensed day care facilities. Changes maximum hours granted to employees from 40 per school year to 40 per calendar year.,1997 California Assembly Bill 47,http://www.leginfo.ca.gov/pub/97-98/bill/asm/ab_0001-0050/ab_47_bill_19961202_introduced.pdf,http://www.leginfo.ca.gov/pub/97-98/bill/asm/ab_0001-0050/ab_47_bill_19970804_history.html,Small Necessities Leave,
Cooperative Development,Ohio Substitute House Bill 434 Revised Code Section 701.07,,1997,Ohio Legislature,http://www.legislature.state.oh.us/,Ohio,Exemplary,State,Act/Ordinance,http://www.BrandeisProject.org/Alice/Web_Folder/Economic_and_Workforce_Development/Cooperative_Development/Ohio_Substitute_House_Bill_434_Revised_Code_Section_701.07.pdf,,,"An act which allows municipal corporations, counties, townships, the state, and certain persons and private entities
to enter into cooperative economic development agreements.",1997 Ohio House Bill 434,http://www.legislature.state.oh.us/bills.cfm?ID=122_HB_434_1,,"Cooperative Development, Economic Development, Development Bonds, Enterprise Zones, Cooperative Economic Development Agreement, CEDA, Joint Economic Development Agreement, ",
Ban on Corporate Environmental Violators,1997 Wayne Corporate Accountability Ordinance ,Wayne Township Environmental Protection Ordinance,1997,Wayne City Council,http://www.ci.wayne.mi.us/council.shtml,Pennsylvania,Exemplary,Municipal ,Act/Ordinance,http://www.BrandeisProject.org/Alice/Web_Folder/Energy_and_Environment/Ban_on_Corporate_Environmental_Violators/1997_Wayne_Corporate_Accountability_Ordinance.pdf,,,Three-strikes your out ordinance for companies that break environmental rules. ,,,,,
Confidentiality in Access to State Benefits and Programs,Model City Policy to Protect Client Confidentiality,,1997,American Civil Liberties Union (cited in National Employment Law Project report),http://www.aclu.org/,,Model,Municipal,Act/Ordinance,http://www.BrandeisProject.org/Alice/Web_Folder/Immigrant_Rights/Confidentiality_in_Access_to_State_Benefits_and_Programs/Model_City_Policy_to_Protect_Client_Confidentiality.pdf,,,"This ordinance/executive order prohibits agencies, officers, or employees from inquiring about the immigration status of any individual applying for or receiving any service of benefit, on behalf of oneself or another, unless immigration status information is specifically required by federal or state law as a condition of receipt of such service or benefit and where immigration status information is a condition of receipt of the service or benefit, the agency, officer, or employee shall make only those inquiries necessary to determine whether an applicant or recipient is an immigrant qualified for such service or benefit.  This ordinance/executive order requires that no agency, officer, or employee shall record information regarding the immigration status of an applicant for or recipient of any service or benefit unless required by federal or state law. Where federal or state law requires the recording of immigration status information, only that information specifically required shall be recorded.",,,,,
Living Wage Requirements in Government Contracts,1997 City of Minneapolis Living Wage Resolution,,1997,Minneapolis City Council,http://www.minneapolismn.gov/council/index.htm,Minnesota,Exemplary,Municipal,Other,http://www.BrandeisProject.org/Alice/Web_Folder/Government_Performance/Living_Wage_Requirements_in_Government_Contracts/1997_City_of_Minneapolis_Living_Wage_Resolution.pdf,,,"A living wage policy requiring businesses benefiting from $100,000 or 
more in city assistance in one year to pay employees a living wage. The 
wage is defined and indexed as 110%of the federal poverty level for
 a family of four. Recipients of such assistance must also set a goal 
that 60% of new jobs will be held by city residents. Additional 
provisions prohibit privatization of services currently performed by 
city employees that would result in lower wages, and preferences for 
assistance to union-friendly businesses. ",,,,"Living Wage, Government Contract, Public Contract, Government Procurement, Service Contracts, Economic Development, Local Hiring, Collective Bargaining",
Living Wage Requirements in Government Contracts,Saint Paul Living Wage Ordinance,,1997,Joint Minneapolis/Saint Paul Living Wage Jobs Task Force,http://www.ilsr.org/,Minnesota,Exemplary,Municipal,Other ,http://www.BrandeisProject.org/Alice/Web_Folder/Government_Performance/Living_Wage_Requirements_in_Government_Contracts/Saint_Paul_Living_Wage_Ordinance.pdf,,,"An act requiring recipients of $100,000 or more of city economic development assistance in one year to pay employees a living wage, defined as 110% of the federal poverty level for a family of four, or 100% of poverty line for companies who provide health
 insurance. In addition, at least 60%of new jobs created as a 
result of such assistance must go to St. Paul residents.",,,,"Living Wage, Government Contract, Public Contract, Government Procurement, Service Contracts, Economic Development, Local Hiring, Health Care",
Anti-Corporate Farming,1998 Mississippi Chapter 537,,1998,Mississippi Legislature ,http://billstatus.ls.state.ms.us/,Mississippi,Exemplary,State,Act/Ordinance,http://www.BrandeisProject.org/Alice/Web_Folder/Energy_and_Environment/Anti-Corporate_Farming/1998_Mississippi_Chapter_537.pdf,,,"Air and water permits; authorize DEQ to exempt agricultural and other operations.

",1998 Mississippi Senate Bill 2895,,http://billstatus.ls.state.ms.us/1998/history/SB/SB2895.htm,,
Regional Investment Via Private Equity Funds,1998 Massachusetts Chapter 259,,1998,Massachusetts Legislature,http://www.malegislature.gov/,Massachusetts,Exemplary,State,Act/Ordinance,http://www.BrandeisProject.org/Alice/Web_Folder/Economic_and_Workforce_Development/Regional_Investment_Via_Private_Equity_Funds/1998_Massachusetts_Chapter_259.pdf,,,,1998 Massachusetts House Bill 5479,,,,
