Paid Sick Days,2011 Connecticut Public Act Number 11-52,,2011,Connecticut Legislature,http://www.cga.ct.gov,Connecticut,Exemplary,State,Act/Ordinance,http://www.BrandeisProject.org/Alice/Web_Folder/Labor_Rights_and_Protections/Paid_Sick_Days/2011_Connecticut_Public_Act_Number_1152.pdf,,http://www.BrandeisProject.org/Alice/Web_Folder/Labor_Rights_and_Protections/Paid_Sick_Days/2006_Sick_Leave_Protection_Model_Act.doc,Requires that employers provide service workers with up to 40 hours of paid sick time per year.,2011 Connecticut Senate Bill 913,http://www.cga.ct.gov/2011/TOB/s/pdf/2011SB-00913-R00-SB.pdf,http://www.cga.ct.gov/asp/cgabillstatus/cgabillstatus.asp?selBillType=Bill&bill_num=913&which_year=2011&SUBMIT1.x=0&SUBMIT1.y=0,Paid Leave,
Paid Sick Days,2011 Seattle Ordinance 123698,Paid Sick Time And Paid Safe Time,2011,Seattle City Council,http://www.seattle.gov/council/,Washington,Exemplary,Municipal,Act/Ordinance,http://www.BrandeisProject.org/Alice/Web_Folder/Labor_Rights_and_Protections/Paid_Sick_Days/2011_Seattle_Ordinance_123698.pdf,,,"Requires employers to provide a certain number of hours annually, depending on business size, to employees for sick leave to care for themselves or others, or for safe leave to address the after-effects of sexual assault.",2011 Seattle Council Bill Number 117216,,,"Paid Leave, Safe Leave, Sick Leave",
Payroll Card Protections,2011 Model State Payroll Card Law,,2011,Consumers Union,http://www.consumersunion.org/,,Model,State,Act/Ordinance,http://www.BrandeisProject.org/Alice/Web_Folder/Labor_Rights_and_Protections/Payroll_Card_Protections/2011_Model_State_Payroll_Card_Law.pdf,,,"Provides that employers shall not use payroll cards in the compensation of employees unless they receive the consent of the employee and also offer direct deposit and paper checks. In addition, employees must be able to use payroll cards to make ATM withdrawals at least twice per month without incurring a fee.",,,,Wage Theft,
Wage Law Enforcement,2011 San Francisco Ordinance 175-11,,2011,San Francisco Board of Supervisors,http://www.sfbos.org/,California,Exemplary,Municipal,Act/Ordinance,http://www.BrandeisProject.org/Alice/Web_Folder/Labor_Rights_and_Protections/Wage_Law_Enforcement/2011_San_Francisco_Ordinance_175_11.pdf,,,"Provides enforcement agency with access to places of business to investigate wage theft cases. Allows agency investigations into wage theft cases to extend beyond one year. Requires employers being investigated to post a notice to all employees indicating that fact. Increases penalties for retaliation by employers against employees and for failure to comply with other requirements under the law. Provides enforcement agency with authority to require the payment of back wages owed to employees to be paid directly to the city, which is then held in escrow until the employee owed wages can be located. Requires enforcement agency to develop outreach materials to conduct education campaigns aimed at employees.",2011 San Francisco File Number 110594,,,Wage Theft,
Wage Law Enforcement,2011 Seattle Ordinance 123596,,2011,Seattle City Council,http://www.seattle.gov/council/,Washington,Exemplary,Municipal,Act/Ordinance,http://www.BrandeisProject.org/Alice/Web_Folder/Labor_Rights_and_Protections/Wage_Law_Enforcement/2011_Seattle_Ordinance_123596.pdf,,,Allows relevant city administrator to refuse to issue or revoke a business license to an applicant or licensee who has been convicted of wage theft. Expands circumstances that qualify as wage theft under municipal law. ,2011 Seattle Council Bill Number 117143,,,Wage Theft,
Wage Law Enforcement,2011 California Chapter 655,Wage Theft Prevention Act of 2011,2011,California State Assembly,http://assembly.ca.gov/,California,Exemplary,State,Act/Ordinance,http://www.BrandeisProject.org/Alice/Web_Folder/Labor_Rights_and_Protections/Wage_Law_Enforcement/2011_California_Chapter_655.pdf,,,"Provides that in addition to any civil penalties following conviction of paying insufficient wages, employers must also pay restitution of wages. Makes it a misdemeanor for employers to willfully violations wage statutes or orders or willfully refuses to pay final court judgments or state agency orders for wages due. Extends the period during which the state enforcement agency can collect penalties or fees from one year to three years after the penalty or fee becomes final. Extends the period of time during which an employer convicted of wage theft must post a bond to ensure payment of wages from 6 months to 2 years. Requires employers to provide each employee when hired with information regarding wages and other information. Allows employees to recover attorney's fees and costs incurred to enforce a judgment for unpaid wages. ",2011 California Assembly Bill 469,http://www.leginfo.ca.gov/pub/11-12/bill/asm/ab_0451-0500/ab_469_bill_20110215_introduced.pdf,http://www.leginfo.ca.gov/pub/11-12/bill/asm/ab_0451-0500/ab_469_bill_20111009_history.html,Wage Theft,
Wage Law Enforcement,2011 Texas Chapter 141,,2011,Texas State Senate,http://www.senate.state.tx.us/,Texas,Exemplary,State,Act/Ordinance,http://www.BrandeisProject.org/Alice/Web_Folder/Labor_Rights_and_Protections/Wage_Law_Enforcement/2011_Texas_Chapter_141.pdf,,,"Closes a loophole allowing employers to escape prosecution if a portion of wages are paid to employees. Provides that in cases where pay is periodic, any intention to not pay wages during or before a pay period constitutes wage theft.",2011 Texas Senate Bill 1024,http://www.capitol.state.tx.us/tlodocs/82R/billtext/pdf/SB01024I.pdf#navpanes=0,http://www.capitol.state.tx.us/BillLookup/History.aspx?LegSess=82R&Bill=SB1024,"Wage Theft, Theft of Service",
Non-Discrimination Against Affordable Housing,2011 Vermont House Bill 59,,2011,Vermont State House,http://www.leg.state.vt.us/HouseMain.cfm,Vermont,Exemplary,State,Act/Ordinance,http://www.BrandeisProject.org/Alice/Web_Folder/Economic_Security/Non-Discrimination_Against_Affordable_Housing/2011_Vermont_House_Bill_59.pdf,,,"This bill prohibits discrimination in land use decisions on the basis of race, sex, sexual orientation, gender identity, age, marital status, religious creed, color, national origin, handicap of a person, or  the fact that a development contains affordable housing units for families or individuals with incomes below 80 percent of the area median income",,,,,
Unemployment Insurance Children's Allowance,2011 New Mexico Chapter 184,,2011,New Mexico legislature,http://www.nmlegis.gov/lcs/,New Mexico,Exemplary,State,Act/Ordinance,http://www.BrandeisProject.org/Alice/Web_Folder/Economic_Security/Unemployment_Insurance_Children's_Allowance/2011_New_Mexico_Chapter_184.pdf,,,Section 1.D. of this act prohibits a contributing base-period employer's account from being charged with any portion of benefits paid to an individual for dependent allowance.,2011 New Mexico House Bill 59; http://www.nmlegis.gov/Sessions/11%20Regular/bills/house/HB0059.pdf,,http://www.nmlegis.gov/lcs/_session.aspx?Chamber=H&LegType=B&LegNo=059&year=11,,
Uniform Partition of Heirs Property Act,2011 Nevada Chapter 76,Uniform Partition of Heirs Property Act,2011,Nevada legislature,http://www.leg.state.nv.us/,Nevada,Exemplary,State,Act/Ordinance,http://www.BrandeisProject.org/Alice/Web_Folder/Economic_Security/Uniform_Partition_of_Heirs_Property_Act/2011_Nevada_Chapter_76.pdf,,,"This act provides procedures for civil actions to partition real property which is owned by two or more persons as joint tenants or tenants in common, including a mechanism for the buyout of the interests of persons who requested a partition of heirs by sale and requires the court to order a partition by physical division of the property if all the interests of the cotenants that requested the partition of the property by sale are not purchased or if there is a cotenant requesting a partition by physical division.",2011 Nevada Assembly Bill 244; ,,,,
Work Share,2011 Maine Chapter 91,Maine Unemployment Insurance Work-sharing Program,2011,Maine Legislature,http://www.maine.gov/legis/,Maine,Exemplary,State,Act/Ordinance,http://www.BrandeisProject.org/Alice/Web_Folder/Economic_Security/Work_Share/2011_Maine_Chapter_91.pdf,,,"This act allows and employer to participate in a work-share program if the employer submits a work-share plan and:plan identifies the affected unit or units and specifies the effective date of the plan; the plan identifies the eligible employees in the affected unit or units by name, social security number, usual weekly hours of work, proposed wage and hour reduction and any other information that the commissioner requires; the plan certifies that the reduction in the usual weekly hours of work is in lieu of temporary layoffs that would have affected at least 10% of the eligible employees in the affected unit or units and that would have resulted in an equivalent reduction in work hours; under the plan the usual weekly hours of work for eligible employees in the affected unit or units are reduced by not less than 10% and not more than 50% and the reduction in hours in each affected unit is spread equally among eligible employees in the affected unit; the plan specifies the manner in which the fringe benefits of the eligible employees will be affected; in the case of eligible employees represented by a collective bargaining agent, the work-sharing plan is approved in writing by the collective bargaining agent that covers the affected eligible employees. In the absence of a collective bargaining agent, the work-sharing plan must contain a certification by the eligible employer that the proposed plan, or a summary of the plan, has been made available to each eligible employee in the affected unit; a statement that the work-sharing plan will not serve as a subsidy of seasonal employment during the off-season or of intermittent employment is included; and the eligible employer agrees to furnish reports relating to the proper conduct of the work-sharing plan and agrees to allow the commissioner or the commissioner's designee or authorized representatives access to all records necessary to verify the plan prior to approval and to monitor and evaluate application of the plan after approval.  The act allows an eligible employee to receive work-sharing benefits with respect to any week only if the commissioner finds that, in addition to meeting other conditions of eligibility for regular benefits under this Title: during the week, the eligible employee is employed as a member of an affected unit under an approved work-sharing plan that was approved prior to that week and that is in effect with respect to the week for which work-sharing benefits are claimed; and the eligible employee is available and able to work the normal workweek with the work-sharing employer.",2011 Maine House Paper 222; http://www.mainelegislature.org/legis/bills/getPDF.asp?paper=HP0222&item=1&snum=125,,http://www.mainelegislature.org/LawMakerWeb/summary.asp?ID=280039313,,
Backyard Apartments,2011 Salt Lake City Accessory Dwelling Ordinance,,2011,Salt Lake City City Council,http://council.slcgov.com/,Utah,Exemplary ,Municipal ,Act/Ordinance,http://www.BrandeisProject.org/Alice/Web_Folder/Infrastructure_and_Smart_Growth/Backyard_Apartments/2011_Salt_Lake_City_Accessory_Dwelling_Ordinance.pdf,,,"An ordinance permitting Accessory Development Units in the city of Salt Lake. Such units, which are currently illegal in areas zoned for single-family
 houses unless granted a waiver, also allow homeowners to offer an 
affordable  housing option to an aging parent, relative or 
college student. These untis would promote more efficient use of the city's housing stock and slim 
carbon footprints, he says. The units also could boost 
sustainable-living practices by permitting an aging parent, relative or 
student to have an affordable housing option in a desirable area.",,,,"Mother-in-Law House, Urban Sprawl, Affordable Housing, Elder Care, Grandmother House, Urban Planning",
Alternatives to Incarceration,2011 Kentucky Chapter 2,,2011,Kentucky legislature,http://www.lrc.ky.gov/, Kentucky ,Exemplary,State,Act/Ordinance,http://www.BrandeisProject.org/Alice/Web_Folder/Public_Safety/Alternatives_to_Incarceration/2011_Kentucky_Chapter_2.pdf,,,Sections 69 and 71 through 73 of this act authorize the creation of community corrections pilot projects focused on area with high rates of target offenders or areas with high rates of supervised individuals who are revoked for violations of their conditions of supervision and ordered to serve a term of imprisonment; require calcutions of the numbers of offenders since the beginning of a pilot project and any funds saved due to the project;establish a local corrections assistance fund; require that 50% of any savings due to a pilot project be deposited in the community corrections fund; and requires the submission of annual reports on the immplementation and results of pilot projects developed under these sections.,,,http://www.lrc.ky.gov/record/11rs/hb463.htm,,
Alternatives to Incarceration,2011 Arkansas Chapter 570,The Public Safety Improvement Act,2011,Arkansas legislature,http://www.arkleg.state.ar.us/assembly/2011/2012F/Pages/Home.aspx,Arkansas,Exemplary,State,Act/Ordinance,http://www.BrandeisProject.org/Alice/Web_Folder/Public_Safety/Alternatives_to_Incarceration/2011_Arkansas_Chapter_570.pdf,,,Section 15 of this act authorizes judicial districts which have drug treatment programs to sentence drug offenders to drug treatment programs in lieu of prison sentences.  Section 21 of this act authorizes a court to suspend imposition of sentence for an eligible offender for a period not to exceed the period of years that is the maximum penalty for the offense to participate in a community work project. ,,,http://www.arkleg.state.ar.us/assembly/2011/2011R/Pages/BillStatusHistory.aspx?measureno=SB750,,
Alternatives to Incarceration,2011 North Carolina Chapter 192,Justice Reinvestment Act,2011,North Carolina legislature,http://www.ncleg.net/,North Carolina,Exemplary,State,Act/Ordinance,http://www.BrandeisProject.org/Alice/Web_Folder/Public_Safety/Alternatives_to_Incarceration/2011_North_Carolina_Chapter_192.pdf,,,"Part V of this act requires a court, in the case of an individual convicted of a misdemeanor possession charge or certian felony charges, who is a first time offender, without entering a judgment of guilt and with the consent of such person, to defer further proceedings and place the individual on probation upon such reasonable terms and conditions as it may require; upon fulfillment of the terms and conditions of the probation, the court shall discharge such an individual and dismiss the proceedings against the individual.",,,http://www.ncleg.net/gascripts/BillLookUp/BillLookUp.pl?Session=2011&BillID=H642,,
Alternatives to Incarceration,2011 Ohio House Bill 86,,2011,Ohio legislature,http://www.legislature.state.oh.us/,Ohio,Exemplary,State,Act/Ordinance,http://www.BrandeisProject.org/Alice/Web_Folder/Public_Safety/Alternatives_to_Incarceration/2011_Ohio_House_Bill_86.pdf,,,This act provides for the establishment and operation of community alternative sentencing centers for misdemeanants sentenced directly to the centers under a community residential sanction or an OVI term of confinement not exceeding 60 days.,,,,,
Corrections Impact Statement on Legislation,2011 Kentucky Chapter 2,,2011,Kentucky legislature,http://www.lrc.ky.gov/,Kentucky,Exemplary,State,Act/Ordinance,http://www.BrandeisProject.org/Alice/Web_Folder/Public_Safety/Corrections_Impact_Statement_on_Legislation/2011_Kentucky_Chapter_2.pdf,,,,,,http://www.lrc.ky.gov/record/11rs/hb463.htm,,
Earned Time Expansion,2011 Ohio House Bill 86,,2011,Ohio legislature,http://www.legislature.state.oh.us/,Ohio,Exemplary,State,Act/Ordinance,http://www.BrandeisProject.org/Alice/Web_Folder/Public_Safety/Earned_Time_Expansion/2011_Ohio_House_Bill_86.pdf,,,"This act increases the ways an inmate may earn early release including the completion of rehabilitation programs, educational, vocational or substance abuse programs",,,http://lsc.state.oh.us/coderev/hou129.nsf/House+Bill+Number/0086?OpenDocument,,
Recidivism Reduction Measures and Performance Incentive Funding,2011 Arkansas Chapter 570,The Performance Incentive Act of 2011,2011,Arkansas legislature,http://www.arkleg.state.ar.us/assembly/2011/2012F/Pages/Home.aspx,Arkansas,Exemplary,State,Act/Ordinance,http://www.BrandeisProject.org/Alice/Web_Folder/Public_Safety/Recidivism_Reduction_Measures_and_Performance_Incentive_Funding/2011_Arkansas_Chapter_570.pdf,,,"This act provides for reinvestment of a percentage of the savings realized under the recidivism strategy implemented into qualifying jurisdictions, determined by a competetive grant process, for jurisdictions that implemented proven risk-reduction strategies that reduce the number of offenders returning to the Department of Correction with no resultant increase in the crime rate.",,,http://www.arkleg.state.ar.us/assembly/2011/2011R/Pages/BillStatusHistory.aspx?measureno=SB750,,
Recidivism Reduction Measures and Performance Incentive Funding,2011 Kentucky Chapter 2,,2011,Kentucky legislature,http://www.lrc.ky.gov/,Kentucky,Exemplary,State,Act/Ordinance,http://www.BrandeisProject.org/Alice/Web_Folder/Public_Safety/Recidivism_Reduction_Measures_and_Performance_Incentive_Funding/2011_Kentucky_Chapter_2.pdf,,,,,,http://www.lrc.ky.gov/record/11rs/hb463.htm,,
Recidivism Reduction Measures and Performance Incentive Funding,2011 North Carolina Chapter 192,Justice Reinvestment Act,2011,North Carolina legislature,http://www.ncleg.net/,North Carolina,Exemplary,State,Act/Ordinance,http://www.BrandeisProject.org/Alice/Web_Folder/Public_Safety/Recidivism_Reduction_Measures_and_Performance_Incentive_Funding/2011_North_Carolina_Chapter_192.pdf,,,,,,http://www.ncleg.net/gascripts/BillLookUp/BillLookUp.pl?Session=2011&BillID=H642,,
Benefits Corporations,2011 California Assembly Bill 361,,2011,California Legislature,http://www.legislature.ca.gov/,California,Exemplary,State,Act/Ordinance,http://www.BrandeisProject.org/Alice/Web_Folder/Economic_and_Workforce_Development/Benefits_Corporations/2011_California_Assembly_Bill_361.pdf,,,"This bill authorizes and regulates the formation and governance of a new form of corporate entity known as a benefit corporation. The bill would also permit an existing corporation to become a benefit corporation by amendment to its articles of incorporation. This bill defines “benefit corporation” to mean a corporation that has been organized under the General Corporation Law and has elected to become subject to the provisions of the bill, as specified. The bill provides that a benefit corporation may be formed for the purpose of creating general public benefit, defined as a material positive impact on society and the environment, taken as a whole, as assessed against a 3rd-party standard, as defined, that satisfies certain requirements. The bill also provides that a benefit corporation may identify one or more specific public benefits, as defined, as an additional purpose of the corporation, including, without limitation, providing low-income or underserved individuals or communities with beneficial products or services, promoting economic opportunity for individuals or communities beyond the creation of jobs in the ordinary course of business, preserving the environment, and improving human health.",2011 California Assembly Bill 361,http://www.leginfo.ca.gov/pub/11-12/bill/asm/ab_0351-0400/ab_361_bill_20110214_introduced.pdf,http://www.leginfo.ca.gov/pub/11-12/bill/asm/ab_0351-0400/ab_361_bill_20111009_history.html,"Economic Development, Benefit Corporation, Corporate Responsibility, Corporate Transparancy, Public Purpose Corporation, Special Purpose Corporation,",
Benefits Corporations,2011 New York Senate Bill 79,,2011,New York Legislature,http://assembly.state.ny.us/,New York,Exemplary,State,Act/Ordinance,http://www.BrandeisProject.org/Alice/Web_Folder/Economic_and_Workforce_Development/Benefits_Corporations/2011_New_York_Senate_Bill_79.pdf,,,"An act which authorizes the incorporation of benefit corporations and provides for the public benefit to be created by benefit corporations, for the election and
termination of the status of a benefit corporation, for the standards of
conduct for directors and officers of a benefit corporation, and for the
preparation and distribution of an annual benefit report by a benefit
corporation.",2001 New York Assembly Bill 79,,http://assembly.state.ny.us/leg/?sh=printbill&bn=S00079&term=2011,"Economic Development, Benefit Corporation, Corporate Responsibility, Corporate Transparancy, Public Purpose Corporation, Special Purpose Corporation,",
Benefits Corporations,2011 Hawaii Senate Bill 298,Sustainable Business Corporations Act,2011,Hawaii Legislature,http://www.capitol.hawaii.gov/,Hawaii,Exemplary,State,Act/Ordinance,http://www.BrandeisProject.org/Alice/Web_Folder/Economic_and_Workforce_Development/Benefits_Corporations/2011_Hawaii_Senate_Bill_298.pdf,,,"This chapter authorizes the organization of a form of business
corporation that offers entrepreneurs and investors the option to build and
invest in businesses that operate in a socially and environmentally responsible
manner.  Enforcement of those responsibilities comes not from governmental
oversight, but rather from new provisions on transparency and accountability
included in this chapter.",2011 Senate Bill 298,http://www.capitol.hawaii.gov/session2011/Bills/SB298_SD1_PROPOSED_.htm,http://www.capitol.hawaii.gov/Archives/measure_indiv_Archives.aspx?billtype=SB&billnumber=298&year=2011,"Economic Development, Benefit Corporation, Corporate Responsibility, Corporate Transparancy, Public Purpose Corporation, Special Purpose Corporation,",
Benefits Corporations,2011 Virginia Acts of Assembly Chapter 698 ,,2011,Virginia Legislature,http://legis.state.va.us/,Virginia,Exemplary,State,Act/Ordinance,http://www.BrandeisProject.org/Alice/Web_Folder/Economic_and_Workforce_Development/Benefits_Corporations/2011_Virginia_Acts_Assembly_Chapter_698.pdf,,,"An act uthorizing a Virginia stock
corporation to elect to be a benefit corporation. A benefit corporation is
required to have, as one of its purposes, the purpose of creating a general
public benefit,which is defined as a material positive impact on society and
the environment taken as a whole, as measured by a third-party standard, from
the business and operations of a benefit corporation. In addition, a benefit
corporation may have the purpose of creating one or more specific public
benefits, which include providing low-income or underserved individuals or
communities with beneficial products or services; promoting economic
opportunity for individuals or communities beyond the creation of jobs in the
normal course of business; preserving the environment; improving human health;
promoting the arts, sciences, or advancement of knowledge; increasing the flow
of capital to entities with a public benefit purpose; and conferring any other
particular benefit on society or the environment. In discharging their duties
and considering the best interests of the benefit corporation, the board of
directors and individual directors consider the effects of any corporate action
on shareholders, employees, customers, and other persons and issues. A benefit
corporation shall deliver to shareholders an annual report describing the ways
in which the corporation generally pursued its general public benefit and
related matters. A copy of the report shall be posted on the corporation's
website. ",2011 Virginia House Bill 2358,http://lis.virginia.gov/cgi-bin/legp604.exe?111+ful+HB2358,http://lis.virginia.gov/cgi-bin/legp604.exe?ses=111&typ=bil&val=hb2358,"Economic Development, Benefit Corporation, Corporate Responsibility, Corporate Transparancy, Public Purpose Corporation, Special Purpose Corporation,",
Local Lending Preferences,2011 District of Columbia Legislation B19-633,Community Bank Small Business Lending Program Act of 2011,2011,Council of the District of Columbia,http://www.dccouncil.washington.dc.us/,Washington D.C. ,Exemplary,Municipal,Act/Ordinance,http://www.BrandeisProject.org/Alice/Web_Folder/Economic_and_Workforce_Development/Local_Lending_Preferences/2011_District_of_Columbia_Legislation_B19-633.pdf,,,"An act to establish a law creating a Community Bank Small Business Lending 
Program; to require bank participants to make loans to small businesses 
in the District in an aggregate amount of at least 200% of incremental 
funds deposited into the bank after the commencement of the program; to 
restrict the definition of qualifying loans to small business loans no 
greater than $3 million or real estate loans no greater than $5 million;
 to require that qualified borrowers be bona fide District small 
businesses; and to institute reporting requirements for participating 
banks.",,,http://dcclims1.dccouncil.us/lims/legislation.aspx?LegNo=B19-0633&Description=%22COMMUNITY+BANK+SMALL+BUSINESS+LENDING+PROGRAM+ACT+OF+2011%22.&ID=41387,"Local Banking, Regional Banking, Small Business Investment",
