No-Excuse Absentee Voting,No-Excuse Absentee and Early Voting Model Act,,2006,Center for Policy Alternatives,,,Model,State,Bill,http://www.BrandeisProject.org/Alice/Web_Folder/Voting_and_Elections/No-Excuse_Absentee_Voting/No-Excuse_Absentee_and_Early_Voting_Model_Act.pdf,,,This bill authorizes absentee and early voting. Absentee voting allows any duly registered citizen to cast an absentee ballot without requiring explanation of his or her desire to vote absentee. Early voting allows any duly registered citizen to cast a ballot at local election supervisors’ offices and designated satellite voting locations within a specified number of days prior to the election. Both policies remove obstacles to voting in ways that preserve the integrity of elections.,,,,,
Re-Enfranchise Ex-Felons,Restoration of Voting Rights Model Act,,2006,Brennan Center,http://www.brennancenter.org/,,Model,State,Bill,http://www.BrandeisProject.org/Alice/Web_Folder/Voting_and_Elections/Re-Enfranchise_Ex-Felons/Restoration_of_Voting_Rights_Model_Act.pdf,,,This bill restores the right to vote upon discharge from incarceration to an individual who has been disenfranchised due to a felony conviction.  This bill requires notification of the loss of the right to vote before a plea of guilty or nolo contendere to a felony and before imposing a felony sentence after trial and  notice of restoration of the right to vote upon discharge from incarceration.,,,,Felon disenfranchisement,
Minimum Wage Increase and Index,Colorado Amendment 42 Minimum Wage Increase,Colorado Minimum Wage,2006,Colorado Iitiative,,Colorado,Exemplary,State,Constitutional Amendment,http://www.BrandeisProject.org/Alice/Web_Folder/Labor_Rights_and_Protections/Minimum_Wage-Increase_and_Index/2006_Colorado_Amendment_42.pdf,,,"An amendment to the Colorado constitution concerning the state minimum  wage, and, in connection therewith, increasing Colorado's minimum wage to $6.85 per hour, adjusted annually for inflation, and providing that no more than $3.02 per hour in tip income may be used to offset the minimum wage of employees who regularly receive tips.",,,,"Prevailing Wage, Minimum Wage, Wage Index, Workforce Development,",
Employee Protection From No Match Letters,2006 Model Santa Fe Resolution,,2006,,,New Mexico,Model,Municipal,Act/Ordinance,http://www.BrandeisProject.org/Alice/Web_Folder/Immigrant_Rights/Employee_Protection_From_No_Match_Letters/2006_Model_Santa_Fe_Resolution.pdf,,,"This ordinance requires that uponupon receipt of a “No-Match” letter, the City of Santa Fe will take no adverse action against any city employee listed on the notice, including firing, laying off, suspending, retaliating, or discriminating against any such employee, and that the City of Santa Fe will not ask any employee, either orally or in writing, to provide documentation to re-verify immigration status, except as required by law.",,,,,
Banning Corporate Water Withdrawals for Resale,Barnstead Water Rights and Local Self-Government Ordinance,,2006, Town of Barnstead,http://www.barnstead.org/,New Hampshire ,Exemplary,Municipal ,Act/Ordinance,http://www.BrandeisProject.org/Alice/Web_Folder/Energy_and_Environment/Banning_Corporate_Water_Withdrawals_for_Resale/Barnstead_Water_Rights_And_Local_Self-Ordinance.pdf,,, Prohibits corporate water withdrawals.,,,,,
City Fleet Biodiesel,2006 Portland Alternative Fuels Ordinance ,,2006,Portland City Council,http://www.portlandonline.com/index.cfm?c=25783,Oregon,Exemplary,Municipal ,Act/Ordinance,http://www.BrandeisProject.org/Alice/Web_Folder/Energy_and_Environment/City_Fleet_Biodiesel/2006_Portland_Alternative_Fuels_Ordinance.pdf,,,Mandate minimum blends of biodiesel and ethanol in petroleum-based fuels sold in Portland and  require city-owned vehicles to maximize use of renewable fuels,,,,,
Climate Action Plan Excise Tax,2006 Boulder Ordinance Number 7483,,2006,Boulder City Council,http://www.bouldercolorado.gov/index.php?option=com_content&task=view&id=68&Itemid=130,Colorado,Exemplary,Municipal ,Act/Ordinance,http://www.BrandeisProject.org/Alice/Web_Folder/Energy_and_Environment/Climate_Action_Plan_Excise_Tax/2006_Boulder_Ordinance_Number_7483.pdf,,,Authorizes the city to levy an excise tax from electricity customers for funding a climate action plan.,,,,Ballot Issue No. 202,
Local Purchasing Preferences,"Local Food Purchasing and Organic Conversion Policies-Woodbury County, Iowa",,2006,Institute for Local Self Reliance,http://www.ilsr.org/,Iowa,Support,County,Other ,http://www.BrandeisProject.org/Alice/Web_Folder/Government_Performance/Local_Purchasing_Preferences/Local_Food_Purchasing_and_Organic_Conversion_Policies_Woodbury_County_Iowa.pdf,,,Summary of the Woodbury County Local Food Purchase Policy,,,,"Local Procurement, Local Food, Government Procurement, Government Contacting,",
Minimum Wage Increase and Index,2006 Arizona Proposition 202,Raise the Minimum Wage for Working Arizonans Act,2006,voteyeson202.com,,Arizona,Exemplary,State,Citizens' Initiative,http://www.BrandeisProject.org/Alice/Web_Folder/Labor_Rights_and_Protections/Minimum_Wage-Increase_and_Index/2006_Arizona_Proposition_202.pdf,,,Provides for annual minimum wage increases for two years and indexing of the minimum wage to a consumer price index measure thereafter.,,,,"Prevailing Wage, Minimum Wage, Wage Index, Workforce Development,",
Paid Sick Days,2006 San Francisco Proposition F,Paid Sick Leave Ordinance,2006,San Francisco Board of Supervisors,http://www.sfbos.org/,California,Exemplary,Municipal,Citizens' Initiative,http://www.BrandeisProject.org/Alice/Web_Folder/Labor_Rights_and_Protections/Paid_Sick_Days/2006_San_Francisco_Proposition_F.pdf,,,"Requires employers to provide up to a minimum of 72 hours of paid sick time, depending on business size, to employees.",,,http://sfpl.org/index.php?pg=2000027201&propid=1780,"Paid Leave, Sick Leave",
Youth Development Fund,Communities Support Healthy Youth Development,,2006,The California Endowment ,http://calendow.org/,California,Support,State,Report,http://www.BrandeisProject.org/Alice/Web_Folder/Education/Youth_Development_Fund/Communities_Support_Healthy_Youth_Development.pdf,,,Report on strategies states can use to implement youth development programs,,,,"After School Programs, School Tutoring, Workforce Development,",
End Use of Abusive Tax Shelters,Abusive Tax Shelters: Impact of Recent California Legislation,,2006,California Legislative Analyst's Office,http://www.lao.ca.gov/laoapp/main.aspx,,Support,State,Report,http://www.BrandeisProject.org/Alice/Web_Folder/Revenue_And_Budget/End_Use_of_Abusive_Tax_Shelters/abusive_tax_shelters_report_Jan_2006.pdf,,,"A report on how recent California legislation has affected and deterred abusive corporate tax shelters, which allow corporations to avoid paying income tax in the state.",,,,,
Expanded Unpaid Family Leave,"State-by-State Guide to
Unpaid, Job-Protected
Extended Time off Laws",,2006,Workplace Flexibility,http://workplaceflexibility2010.org/,,Support,State,Report,http://www.BrandeisProject.org/Alice/Web_Folder/Labor_Rights_and_Protections/Expanded_Unpaid_Family_Leave/State_FMLA_chart_FINAL.pdf,,,"Spreadsheet of state legislation relating to unpaid, job protected time off ",,,,"Paid Leave, FMLA, Family Medical Leave Act,",
Economic Development Incentive Grant,Basic Municipal Law Seminar,,2006,"Jeff Moore Brown & Hofmeister, L.L.P. ",http://www.bhlaw.net/,Texas,Support,State,Report,http://www.BrandeisProject.org/Alice/Web_Folder/Infrastructure_and_Smart_Growth/Economic_Development_Incentive_Grant/Basic_Municipal_Law_Seminar.pdf,,,Report on how Texas municipalities can use economic development strategies under the Texas state statutes,,,,"Economic Development, MUDs, Municipal Utilities District",
PerformanceStat,Less is More: Progressive Approaches to Governmental Accountability,,2006,"Public Works, Eric Schnurer",http://www.stateinnovation.org,,Support,,Report ,http://www.BrandeisProject.org/Alice/Web_Folder/Government_Performance/PerformanceStat/Less_is_More_Progressive_Approaches_to_Governmental_Accountability.pdf,,,A report on the effectiveness of performance measurement programs,,,http://www.in.gov/apps/lsa/session/billwatch/billinfo?year=2010&request=getActions&doctype=HB&docno=1003,"StateStat, PerformanceStat, Performance Measurement, CompStat, CitiStat,",
Local and Organic Food Purchasing Policy,2006 Woodbury County Local Food Purchasing Resolution ,,2006,Woodbury City Council,http://www.woodburyiowa.com/,Iowa,Exemplary,Municipal,Other,http://www.BrandeisProject.org/Alice/Web_Folder/Health/Local_and_Organic_Food_Purchasing_Policy/2005_Woodbury_County_Local_Food_Purchasing_Resolution.pdf,,,"An act requiring Woodbury County purchase, by or through its food service contractor, locally produced organic food when a department of Woodbury County serves food in the usual course of
 business. The contractor may cover unavailable local organic supply 
through its current procurement practices with preference to be given 
local non-organic food products. An arbitration board shall be 
established to assure fair value to Woodbury County. A 
single-point-of-contact broker, located in Woodbury County, shall 
interact with food service contractor, for availability, price, quality,
 presentation and delivery terms of all locally produced organic food",,,,"Local Procurement, Local Food, Organic Food, Government Procurement, Government Contracting",
Windfall Profit Tax on Oil,2007 Washington House Bill 1510,,2007,Washington Legislature,http://www.leg.wa.gov/pages/home.aspx,Washington,Exemplary,State,Act/Ordinance,http://www.BrandeisProject.org/Alice/Web_Folder/Revenue_And_Budget/Windfall_Profit_Tax_on_Oil/2007_Washington_House_Bill_1510.pdf,,,"An act to create a tax intended to create an incentive for major oil companies to keep retail gasoline prices at historically reasonable levels and a disincentive to increase prices to gain windfall profits. If oil companies choose to raise their prices to an unreasonable level, the tax the tax will generate substantial revenue which can be used to partially offset the adverse effects of high gasoline prices by providing additional funding for public goods and services that are linked to the current costs of  energy or the development of renewable in-state energy resources.",,,http://apps.leg.wa.gov/billinfo/summary.aspx?bill=1510&year=2007#history,,
Complete Streets,2007 Illinois Public Act 095-0665,,2007,Illinois Legislature,http://www.ilga.gov/,Illinois,Exemplary ,State,Act/Ordinance,http://www.BrandeisProject.org/Alice/Web_Folder/Infrastructure_and_Smart_Growth/Complete_Streets/2007_Illinois_Public_Act_095-0665.pdf,,,"Amends the Illinois Highway Code. Provides that bicycle and pedestrian ways shall be given full consideration in the planning and development of transportation facilities, including the incorporation of such ways into State-funded transportation plans and programs. Provides that bicycle and pedestrian ways shall be established in conjunction with the construction, reconstruction, or other change of any State transportation facility, and special emphasis shall be given to projects in or within one mile of an urban area. Provides for exceptions. Requires the Department of Transportation to establish design and construction standards for bicycle and pedestrian ways.",2007 Illinois Senate Bill 314,http://www.ilga.gov/legislation/95/SB/PDF/09500SB0314.pdf,http://www.ilga.gov/legislation/billstatus.asp?DocNum=0314&GAID=9&GA=95&DocTypeID=SB&LegID=27915&SessionID=51&SpecSess=#actions,"Public Transportation, Bike Policy, Urban Planning",
Environmental Protections in Schools,2007 Connecticut Public Act Number 07-168,,2007,Connecticut Legislature ,http://www.cga.ct.gov/,Connecticut ,Exemplary,State,Act/Ordinance,http://www.BrandeisProject.org/Alice/Web_Folder/Energy_and_Environment/Environmental_Protections_in_Schools/2007_Connecticut_Public_Act_Number_07_168.pdf,,,Prohibits the application of lawn care pesticides on the grounds of any public or private school with students in grade eight or lower,2007 Connecticut House Bill 5234,,http://www.cga.ct.gov/asp/cgabillstatus/cgabillstatus.asp?selBillType=Bill&bill_num=5234&which_year=2007&SUBMIT1.x=0&SUBMIT1.y=0&SUBMIT1=Normal,,
Green Building Requirements,Green Buildings Model Act ,,2007,Center for Policy Alternatives,,,Model ,State,Act/Ordinance,http://www.BrandeisProject.org/Alice/Web_Folder/Energy_and_Environment/Green_Building_Requirements_and_Updated_Building_Codes/Green_Building_Model_Act.pdf,,,"Adopts LEED standards for the construction or renovation of  public buildings over 5,000 square feet in size.",,,,,
Residential Energy Efficiency Standards,Green Housing Model Act ,,2007,Center for Policy Alternatives,,,Model ,State,Act/Ordinance,http://www.BrandeisProject.org/Alice/Web_Folder/Energy_and_Environment/Residential_Energy_Efficiency_Standards/Green_Housing_Model_Act.pdf,,,This law is enacted to protect the health and welfare of residents by lowering energy costs and reducing air pollution.,,,,,
Utility Rate Decoupling,2007 Connecticut Public Act No. 07-242,,2007,Connecticut Legislature ,http://www.cga.ct.gov/,Connecticut ,Exemplary,State,Act/Ordinance,http://www.BrandeisProject.org/Alice/Web_Folder/Energy_and_Environment/Utility_Rate_Decoupling/2007_Connecticut_Public_Act_No_07_242.pdf,,,"This act makes many substantive changes to the state's energy laws. Among other things, it restores funding for the electric conservation and clean energy funds and establishes new energy efficiency programs and tax incentives for energy efficiency and renewable energy. There are separate efficiency measures for electricity, heating fuels, and vehicles.",2007 Connecticut House Bill 7432,,http://www.cga.ct.gov/asp/cgabillstatus/cgabillstatus.asp?selBillType=Bill&bill_num=7432&which_year=2007&SUBMIT1.x=12&SUBMIT1.y=14&SUBMIT1=Normal,,
Civil Unions,Civil Union Equality Model Act,,2007,Center for Policy Alternatives,,,Model,State,Act/Ordinance,http://www.BrandeisProject.org/Alice/Web_Folder/Civil_Rights/Civil_Unions/Civil_Union_Equality_Model_Act.pdf,http://www.BrandeisProject.org/Alice/Web_Folder/Civil_Rights/Civil_Unions/Civil_Union_Equality_Model_Act.pdf,http://www.BrandeisProject.org/Alice/Web_Folder/Civil_Rights/Civil_Unions/Civil_Union_Equality_Model_Act.docx,"The act allows same-sex couples to enter into civil unions, giving 
them many of the benefits of marriage.",,,,,
Domestic Partnership,Domestic Partnership Model Act,,2007,Center for Policy Alternatives,,,Model,State,Act/Ordinance,http://www.BrandeisProject.org/Alice/Web_Folder/Civil_Rights/Domestic_Partnerships/Domestic_Partnership_Model_Act.pdf,http://www.BrandeisProject.org/Alice/Web_Folder/Civil_Rights/Domestic_Partnerships/Domestic_Partnership_Model_Act.pdf,http://www.BrandeisProject.org/Alice/Web_Folder/Civil_Rights/Domestic_Partnerships/Domestic_Partnership_Model_Act.docx,The act allows unmarried couples certain specified rights enjoyed by married couples.Domestic Partnership is a legal relationship that is formed between two individuals who are not married and intend to live together as spouses.,,,,,This model was separated out from the CPA Civil Union Equality Model Act
LGBTQ Anti-Discrimination,2007 Iowa Senate File 427,,2007,Iowa Legislature,https://www.legis.iowa.gov/index.aspx,Iowa,Exemplary,State,Act/Ordinance,http://www.BrandeisProject.org/Alice/Web_Folder/Civil_Rights/LGBTQ_Anti-Discrimination/2007_Iowa_Senate_File_427.pdf,http://www.BrandeisProject.org/Alice/Web_Folder/Civil_Rights/LGBTQ_Anti-Discrimination/2007_Iowa_Senate_File_427.pdf,,"The act prohibits discrimination by employers, landlords, other entities and services, by adding the categories of Sexual Orientation and Gender Identity to the state's civil rights laws. ",,,,,
After-School Programs,2007 Minnesota House Bill 976,,2007,Minnesota Legislature,http://www.leg.state.mn.us/,Minnesota,Exemplary,State,Act/Ordinance,http://www.BrandeisProject.org/Alice/Web_Folder/Education/After-School_Programs/2007_Minnesota_House_File_976.pdf,,,"After-school community learning grant program established, and money appropriated.",,,https://www.revisor.leg.state.mn.us/revisor/pages/search_status/status_detail.php?b=House&f=HF0976&ssn=0&y=2007,"After School Programs, School Tutoring",
Best Value Contracting,2007 Madison Legislative File Number 5139,,2007,Madison City Council,http://www.cityofmadison.com/council/,Wisconsin,Exemplary,Municipal,Act/Ordinance,http://www.BrandeisProject.org/Alice/Web_Folder/Government_Performance/Best_Value_Contracting/2007_Madison_Legislative_File_Number_5139.pdf,,,An ordinance adopting procedures known as best value contracting for public construction contracts and projects accepting TIF financing. ,,,http://madison.legistar.com/ViewReport.ashx?M=R&N=Master&GID=205&ID=1058438&GUID=E4F7935D-CA88-4DCF-BDE5-DC6287763CC8&Title=Legislation+Details,"Best Value Contracting, TIF, Government Contracting",
Local Purchasing Preferences,2007 Madison Legislative File Number 05943,Local Preference Purchasing Policy,2007,Madison City Council,http://www.cityofmadison.com/council/,Wisconsin,Exemplary,Municipal,Act/Ordinance,http://www.BrandeisProject.org/Alice/Web_Folder/Government_Performance/Local_Purchasing_Preferences/2007_Madison_Legislative_File_Number_05943.pdf,,,"this local preference
 purchasing policy will establish new administrative responsibilities 
for staff in the many operating departments who participate in the daily purchasing activities
 of City government.  A city agency would be responsible for developing an on-line 
system for vendors to identify themselves as ""local""
 and to maintain a list of these vendors on the City's web site for use 
by City staff and the public.  Central Purchasing would be responsible 
for modifying current bid and RFP document formats to incorporate local preference criteria into the standard vendor selection processes for purchases
 over $25,000.  Staff in all City agencies that make purchasing 
decisions over $5,000 would be responsible for incorporating the same 
criteria into their competitive selection processes when making vendor 
selections.  Based on the proposed policy structure and the 4-month 
implementation timeline, it is likely that the necessary implementation 
work can be accomplished with available staff resources.
 The policy also creates a 1% price preference or a 5% scoring preference for local vendors responding to non-public works bids, requests for quotations and requests for proposals. ",,,http://madison.legistar.com/ViewReport.ashx?M=R&N=Master&GID=205&ID=1059137&GUID=1AA02B33-D08C-441E-8217-78B828B98555&Title=Legislation+Details,"Small Business, Local Procurement, Local Business, Government Procurement, Government Contracting,",
PerformanceStat,2007 Maryland Chapter 7,StateStat,2007,Maryland Legislature,http://mlis.state.md.us/,Maryland ,Exemplary,State,Act/Ordinance,http://www.BrandeisProject.org/Alice/Web_Folder/Government_Performance/PerformanceStat/2007_Maryland_Chapter_7.pdf,,,An act creating a StateStat accountability process to enhance themanaging for results process; authorizing the Governor to require certainagencies to participate in the StateStat process; requiring certain agencies to submit certain strategic plans and performance measurement reports to theSecretary of Budget and Management as part of a certainbudget submission; requiring the performance measurement reports to contain certain information.,2007 Maryland House Bill 137,http://mlis.state.md.us/2007RS/bills/hb/hb0137f.pdf,http://mlis.state.md.us/2007rs/billfile/hb0137.htm,"StateStat, PerformanceStat, Performance Measurement, CompStat, CitiStat, ",
Corporate Tax Disclosure Requirements,2007 Model State Corporate Income Tax Disclosure Act,,2007,Center on Budget and Policy Priorities,http://www.cbpp.org/,,Model,State,Act/Ordinance,http://www.BrandeisProject.org/Alice/Web_Folder/Revenue_And_Budget/Corporate_Tax_Disclosure_Requirements/2007_Model_State_Corporate_Income_Tax_Disclosure_Act.pdf,,,"A model act and report on increasing transparency in corporate income tax payments to the state, and improving the use of economic subsidies provided to corporations, as well as a provision for subsidy ""clawbacks"" when funds are not being used by the recipient corporation as agreed. ",,,,,
Expanded Paid Family Leave,2007 Washington Chapter 357,,2007,Washington State House,http://www.leg.wa.gov/house/Pages/default.aspx,Washington,Exemplary,State,Act/Ordinance,http://www.BrandeisProject.org/Alice/Web_Folder/Labor_Rights_and_Protections/Expanded_Paid_Family_Leave/2007_Washington_Chapter_357.pdf,,,"In 2007, the Washington State Legislature established the Family Leave Insurance program to provide temporary income support to working parents who are on leave to care for a newborn baby or for a child newly placed for adoption.
The program, administered by the Employment Security Department, was designed to provide up to $250 per week for up to five weeks to each eligible parent beginning in the fall of 2009. However, due to the budget challenges in state government, the Legislature approved legislation in 2011 that postpones the start of the program until October 1, 2015.

",2007 Washington House Bill 1658,,,"Paid Leave, FMLA, Family Medical Leave Act,",
Industry Specific Wage Standards,2007 Los Angeles Ordinance 178432,Airport Hospitality Enhancement Zone Ordinance,2007,Los Angeles City Council,http://www.lacity.org/YourGovernment/CityCouncil/index.htm,California,Exemplary,Municipal,Act/Ordinance,http://www.BrandeisProject.org/Alice/Web_Folder/Labor_Rights_and_Protections/Industry_Specific_Wage_Standards/2007_Los_Angeles_Ordinance_178432.pdf,,,"Requires that hotels within specified zone pay employees a living wage of $9.39 with health benefits or $10.64 without health benefits, increasing annually with inflation. ",2007 Los Angeles File Number 06-0362-S3,,,"Prevailing Wage, Minimum Wage, Wage Index, Workforce Development,",
Prohibition on Mandatory Workplace Meetings,2007 Worker Freedom Model Act,Worker Freedom Act,2007,Center for Policy Alternatives,,,Model,State,Act/Ordinance,http://www.BrandeisProject.org/Alice/Web_Folder/Labor_Rights_and_Protections/Prohibition_on_Mandatory_Workplace_Meetings/2007_Worker_Freedom_Model_Act.pdf,,,"Prohibits employers from requiring workers to attend meetings where the employer lectures on religious or political beliefs, including beliefs about joining a union.",,,,,
State Neutrality in Labor Organizing,2007 State Neutrality in Labor Organizing Model Act,State Neutrality in Labor Organizing Act,2007,Center for Policy Alternatives,,,Model,State,Act/Ordinance,http://www.BrandeisProject.org/Alice/Web_Folder/Labor_Rights_and_Protections/State_Neutrality_in_Labor_Organizing/2007_State_Neutrality_in_Labor_Organizing_Model_Act.pdf,,X:/COWS Program/ALICE/Web_Folder/Labor_Rights_and_Protections/State_Neutrality_in_Labor_Organizing_2007_State_Neutrality_in_Labor_Organizing_Model_Act.doc,Prohibits state contractors from using state funds on activities that deter labor organizing among their employees.,,,,,
Community Impact Report,2007 Maine Public Law Chapter 347,Informed Growth Act,2007,Maine Legislature,http://www.maine.gov/legis/,Maine,Exemplary,State,Act/Ordinance,http://www.BrandeisProject.org/Alice/Web_Folder/Economic_and_Workforce_Development/Community_Impact_Report/2007_Maine_Public_Law_Chapter_347.pdf,,,"This bill enacts the Informed Growth Act to supplement existing municipal project application review criteria with a comprehensive impact study specifically related to the impact of large-scale retail development. It requires an applicant seeking a permit to build a large-scale retail development that is larger than 75,000 square feet to pay for a comprehensive impact study, a public hearing and related municipal staff support in order to estimate the positive and negative economic and environmental effects of the project on the local area prior to permit approval. The study must be presented at a public hearing before the municipal reviewing authority held simultaneously with its review of the permit application.In order for approval for the application to be given, the municipal reviewing authority must determine,based on the comprehensive impact study, other materials and a public hearing, that the project would have no undue adverse impact on the local area.This bill ensures that municipalities that do not have a site plan ordinance or zoning ordinance have the ability to assess the projected impacts of a large-scale retail development without having to pay forthe study.",2007 Maine House Bill 1262,http://www.mainelegislature.org/legis/bills/bills_123rd/billpdfs/HP126201.pdf,http://www.mainelegislature.org/LawMakerWeb/dockets.asp?ID=280024788,"Economic Impact Asseessment, Economic Development, Community Development, Local Economy,",
Skills Panels,2008 Washington Chapter 103,,2007,Washington Legislature,http://www.leg.wa.gov/pages/home.aspx,Washington,Exemplary,State,Act/Ordinance,http://www.BrandeisProject.org/Alice/Web_Folder/Economic_and_Workforce_Development/Skills_Panels/2008_Washington_Chapter_103.pdf,,,An act which directs the Workforce Training and Education Coordinating Board (WTECB) to allocate grants to support Industry Skill Panels. The WTECB must establish standards to evaluate the products and services created by skill panels.,2007 Washington Senate Bill 5254,http://apps.leg.wa.gov/documents/billdocs/2007-08/Pdf/Bills/Senate%20Bills/5254.pdf,http://apps.leg.wa.gov/billinfo/summary.aspx?bill=5254&year=2007,"Workforce Development, Industry Sectors, Clusters, Economic Development, Sector Strategies, Industry Partnerships, Skills Panels, ",
