Limited Liability Low Profit Company,2009 North Carolina Session Law 2010-187,,2009,North Carolina Legislature,http://www.ncleg.net/,North Carolina,Exemplary,State,Act/Ordinance,http://www.BrandeisProject.org/Alice/Web_Folder/Economic_and_Workforce_Development/Limited_Liability_Low_Profit_Company/2009_North_Carolina_Session_Law_2010-187.pdf,,,"An act to provide for the creation of Low-Profit Limited Liability Companies in the state. A low-profit limited liability company (L3C) is a legal form of business entity in the United States that was created to bridge the gap between non-profit
 and for-profit investing by providing a structure that facilitates 
investments in socially beneficial, for-profit ventures while 
simplifying compliance with Internal Revenue Service rules for ""Program Related Investments"".",2010 North Carolina Senate Bill 308,http://www.ncleg.net/Sessions/2009/Bills/Senate/HTML/S308v0.html,http://www.ncga.state.nc.us/gascripts/BillLookUp/BillLookUp.pl?Session=2009&BillID=S308&view=history_rss,"L3C, L3c, Social Enterprise, Economic Development, Corporations",
Limited Liability Low Profit Company,2009 Utah Chapter 141,,2009,Utah Legislature,http://le.utah.gov/#iframe,Utah,Exemplary,State,Act/Ordinance,http://www.BrandeisProject.org/Alice/Web_Folder/Economic_and_Workforce_Development/Limited_Liability_Low_Profit_Company/2009_Utah_Chapter_141.pdf,,,"An act to provide for the creation of Low-Profit Limited Liability Companies in the state. A low-profit limited liability company (L3C) is a legal form of business entity in the United States that was created to bridge the gap between non-profit
 and for-profit investing by providing a structure that facilitates 
investments in socially beneficial, for-profit ventures while 
simplifying compliance with Internal Revenue Service rules for ""Program Related Investments"".",2009 Utah Senate Bill 148,http://le.utah.gov/~2009/bills/sbillint/sb0148.pdf,http://le.utah.gov/~2009/status/sbillsta/sb0148.htm,"L3C, L3c, Social Enterprise, Economic Development, Corporations",
Limited Liability Low Profit Company,2009 Wyoming Chapter 55,,2009,Wyoming Legislature,http://legisweb.state.wy.us/LSOWEB/Default.aspx,Wyoming,Exemplary,State,Act/Ordinance,http://www.BrandeisProject.org/Alice/Web_Folder/Economic_and_Workforce_Development/Limited_Liability_Low_Profit_Company/2009_Wyoming_Chapter_55.pdf,,,"An act to provide for the creation of Low-Profit Limited Liability Companies in the state. A low-profit limited liability company (L3C) is a legal form of business entity in the United States that was created to bridge the gap between non-profit
 and for-profit investing by providing a structure that facilitates 
investments in socially beneficial, for-profit ventures while 
simplifying compliance with Internal Revenue Service rules for ""Program Related Investments"".",2009 Wyoming House Bill 182,http://legisweb.state.wy.us/2009/Introduced/HB0182.pdf,http://legisweb.state.wy.us/2009/Digest/HB0182.htm,"L3C, L3c, Social Enterprise, Economic Development, Corporations",
Collective Bargaining for Child Care Workers,2009 Washington House Bill 1329,,2009,Washington Legislature,http://www.leg.wa.gov/pages/home.aspx,Washington,Exemplary,State,Bill,http://www.BrandeisProject.org/Alice/Web_Folder/Education/Collective_Bargaining_for_Childcare_Workers/2009_Washington_House_Bill_1329.pdf,,,"This bill creates a new type of collective bargaining for child care 
directors and workers whereby they can come together and bargain with 
the state over matters within the state's purview to improve the quality
 of child care for the state's families, including compensation, 
professionalization, benefits, education, and subsidies.",,,http://apps.leg.wa.gov/billinfo/summary.aspx?bill=1329&year=2009,"Collective Bargaining, Child Care, ",
Evidence-Based Privatization,2009 Oregon Assembly Bill 2037,,2009,Oregon Legislature,http://www.leg.state.or.us/,Oregon ,Exemplary,State,Bill,http://www.BrandeisProject.org/Alice/Web_Folder/Government_Performance/Evidence-Based_Privatization/2009_Oregon_Assembly_Bill_2037.pdf,,,"An act requiring the Oregon Department of Administrative Services and local contracting agencies to maintain records concerning public contracts and to submit reports concerning that information to the Governor and the Legislative Assembly. The act also makes such records public, and requires agencies to make records available online.",,,,"Government Contract, Public Contracts, Public Records, Government Procurement",
Regulation of Government Use of Private Contractors,2009 Indiana House Bill 1003,,2009,Indiana Legislature,http://www.in.gov/legislative/index.htm,Indiana,Exemplary,State,Bill,http://www.BrandeisProject.org/Alice/Web_Folder/Government_Performance/Regulation_of_Government_Use_of_Private_Contractors/2009_Indiana_House_Bill_1003.pdf,,,"an act which prohibits the the state from contacting with a private entity to administer or process eligibility intake
for government entitlement programs.  Exempts from the prohibition a health care
provider who determines that an individual is presumptively eligible
for Medicaid as allowed in the Medicaid state plan.  Repeals a
requirement that a contractor of the specified programs make certain
reports. ",,,http://www.in.gov/apps/lsa/session/billwatch/billinfo?year=2010&request=getActions&doctype=HB&docno=1003,"Government Contract, Public Contract, Government Procurement, Service Contracts, Government Entitlement, Medicaid, Food Stamps, Welfare",cannot find bill on website
Banning Non-Compete Agreements,2009 Massachusetts House Bill 1794,,2009,Massachusetts Legislature,http://www.malegislature.gov,Massachusetts,Exemplary,State,Bill,http://www.BrandeisProject.org/Alice/Web_Folder/Labor_Rights_and_Protections/Banning_Non-compete_Agreements/2009_Massachusetts_House_Bill_1794.pdf,,,"Any written or oral contract or agreement arising out of an employment relationship that prohibits, impairs, restrains, restricts, or places any condition on, a person's ability to seek, engage in or accept any type of employment or independent contractor work, for any period of time after an employment relationship has ended, shall be void and unenforceable with respect to that restriction.",,,,"No-Compete Agreement, ",
Successor Firm Job Security,2009 Hawaii House Bill 396,,2009,Hawaii State House,http://www.capitol.hawaii.gov,Hawaii,Exemplary,State,Bill,http://www.BrandeisProject.org/Alice/Web_Folder/Labor_Rights_and_Protections/Successor_Firm_Job_Security/2009_Hawaii_House_Bill_396.pdf,,,Establishes job security requirements upon the divestiture of a covered establishment if the covered establishment employs 100 or more persons. ,,,http://www.capitol.hawaii.gov/Archives/measure_indiv_Archives.aspx?billtype=HB&billnumber=396&year=2010,"Layoffs, Job Security",
Worker Adjustment and Retraining Notification (WARN),2009 California Assembly Bill 842,,2009,California State Assembly,http://assembly.ca.gov/,California,Exemplary,State,Bill,http://www.BrandeisProject.org/Alice/Web_Folder/Labor_Rights_and_Protections/Warn_Act_For_States/2009_California_Assembly_Bill_842.pdf,,,"Requires employers to provide employees with 90 days notice prior to mass layoffs, rather than current law's 60 days. Requires employers to provide employees with certain information once notice is given, and requires employees to provide space for rapid response activities to address affected employees' job search. Requires state labor agency to compile a list of resources to assist employees after layoffs, as well as a list of resources to help employers avert mass layoffs.",,,http://www.leginfo.ca.gov/pub/09-10/bill/asm/ab_0801-0850/ab_842_bill_20100202_history.html,"Layoffs, Job Security ",
Earned income Tax Credit and Tax Exemptions,Earned Income Tax Credit Model Act,,2009,Center for State Innovation ,http://www.stateinnovation.org,,Model,State,Bill,http://www.BrandeisProject.org/Alice/Web_Folder/Economic_Security/Earned_Income_Tax_Credit_and_Tax_Exemptions/Earned_Income_Tax_Credit_Model_Act.pdf,,,"This bill authorizes a tax credit equal to 20 percent of the earned income credit allowed under section 32 of the federal Internal Revenue Code. If the credit exceeds tax owed, the [Tax Commissioner] shall treat such excess as an overpayment, and shall pay the taxpayer, without interest, the amount of such excess.",,,,,
Mandatory Foreclosure Mediation,Judicial Mediation Foreclosure Program Model Bill ,,2009,National Consumer Law Center,http://www.nclc.org,,Model,State,Bill,http://www.BrandeisProject.org/Alice/Web_Folder/Economic_Security/Mandatory_Foreclosure_Mediation/Judicial_Mediation_Foreclosure_Program_Model_Bill.pdf,,,"This bill: establishes certain requirements for a complaint seeking to foreclose; prohibits the accrual of additional fees and the pursuit of further action during mediation; requires notice by the clerk of the court be sent to the parties, including instructions to the plaintiff to bring proof of authority to bind the holder and proof of identity of the holder; and provides for privilege against disclosure of mediation information; and requires the cost of mediation for the first 3 hours to be split evenly between the parties, with the plaintiff initially advancing the entire amount.",,,,,
Mandatory Foreclosure Mediation,Non-Judicial Mediation Foreclosure Program Model Bill,,2009,National Consumer Law Center,http://www.nclc.org,,Model,State,Bill,http://www.BrandeisProject.org/Alice/Web_Folder/Economic_Security/Mandatory_Foreclosure_Mediation/Non-Judicial_Mediation_Foreclosure_Program_Model_Bill.pdf,,,"This bill: requires loan servicer to provide notice of default to the homeowner(s) and file a copy with the appropriate state agency (agency); prohibits the accrual of additional fees and the pursuit of further action during mediation; requires the agency, upon reciept of notice, to send a notice of mediation to the parties, specifying the initial session to occur within 30 days of the filing of the notice of default, including instructions to the servicer to bring proof of authority to bind the holder and proof of identity of the holder; if the homeowner is unsuccessfull, requires the agency, upon filing of the mediator's report, to inform the homeowner that he or she may opt for judicial foreclosure mediation; requires the cost of mediation for the first 3 hours to be split evenly between the parties, with the plaintiff initially advancing the entire amount; and provides for privilege against disclosure of mediation information.",,,,,
Universal Voluntary Accounts,2009 California Assembly Bill 125,,2009,California legislature,http://www.legislature.ca.gov/,Calfornia,Exemplary,State,Bill,http://www.BrandeisProject.org/Alice/Web_Folder/Economic_Security/Universal_Voluntary_Accounts/2009_California_Assembly_Bill_125.pdf,,,"This bill creates the California Employee Savings Program (CalPERS), under the administration of the California Public Employees' Retirement System (CalESP) to provide retirement savings opportunities to California's private sector employees, specifically, the bill: requires CalPERS to offer one or more individual retirement accounts or annuities (IRAs) or defined benefit plans to eligible employees of participating employers; and specifies that participating employers and their eligible employees are not members or participants of CalPERS and that CalESP will not create a new public pension system.",,,http://www.leginfo.ca.gov/pub/09-10/bill/asm/ab_0101-0150/ab_125_bill_20101130_history.html,,
Universal Voluntary Accounts,2009 Connecticut Senate Bill 971,,2009,Connecticut legislature,http://www.cga.ct.gov/,Connecticut,Exemplary,State,Bill,http://www.BrandeisProject.org/Alice/Web_Folder/Economic_Security/Universal_Voluntary_Accounts/2009_Connecticut_Senate_Bill_971.pdf,,,"This bill requires the Comptroller to establish a tax-qualified defined contribution retirement program to provide retirement investment plans to self-employed individuals, small employers and organizations qualifying as tax-exempt. The bill requires the Comptroller to minimize costs by helping small employers and individuals purchase retirement savings plans, arrangements and investments through economies of scale, standardization and other measures.  ",,,http://www.cga.ct.gov/asp/cgabillstatus/cgabillstatus.asp?selBillType=Bill&bill_num=SB00971&which_year=2009,,
Lifelong Learning Accounts,2009 California House Bill 1320,"Lifelong Learning Accounts Initiative
        Program",2009,California Legislature,http://www.legislature.ca.gov/,California,Exemplary,State,Bill,http://www.BrandeisProject.org/Alice/Web_Folder/Economic_and_Workforce_Development/Lifelong_Learning_Accounts/2009_California_House_Bill_1320.pdf,,,"This bill would, beginning January 1, 2012, create the Lifelong Learning Accounts Pilot Program, for the purpose of providing grants to employers and employees to be used to establish individual lifelong learning accounts, as defined, for the deposit of funds to be used by those employees and employers for purposes related to lifelong education and training. The bill would require the board to establish agrant program and implement and administer the program, as specified.The bill would require the board to prepare and submit a report to specified legislative fiscal and policy committees, evaluating theeffectiveness of the program, as prescribed. The bill would provide that  its provisions shall only be implemented if the Director of Finance makes a written determination that there are sufficient state funds available for that purpose.",,http://www.leginfo.ca.gov/pub/09-10/bill/asm/ab_1301-1350/ab_1320_bill_20090227_introduced.pdf,http://www.leginfo.ca.gov/pub/09-10/bill/asm/ab_1301-1350/ab_1320_bill_20101130_history.html,"LiLA, Workforce Development, Economic Development, Lifelong Learning",
Early Voting,No-Excuse Absentee and Early Voting Model Act,,2009,Center for State Innovation,http://www.stateinnovation.org/,,Model,State,Bill,http://www.BrandeisProject.org/Alice/Web_Folder/Voting_and_Elections/Early_Voting/No-Excuse_Absentee_and_Early_Voting_Model_Act.pdf,,,This bill allows voters receive an absentee ballot without providing an explanation and allows a person to vote prior to Election Day beginning 15 days before the election.,,,http://apps.leg.wa.gov/billinfo/summary.aspx?bill=6362&year=2006,,
Instant Run-Off Voting,2009 Missouri House Bill 463,,2009,Missouri legislature,http://www.moga.mo.gov/,Missouri,Exemplary,State,Bill,http://www.BrandeisProject.org/Alice/Web_Folder/Voting_and_Elections/Instant_Run-Off_Voting/2009_Missouri_House_Bill_463.pdf,,,"This bill establishes procedures for instant runoff voting and the counting of ranked-choice ballots.  Any municipality or political subdivision may conduct instant runoff voting or use ranked-choice ballots.  Generally, if there is no simple majority winner, the candidate with the fewest votes is eliminated and the process continues by counting the votes for the next most preferred candidate on those ballots where the eliminated candidate was the top choice.  The process continues until a winner by simple majority emerges or a tie results.  The procedure for breaking ties will remain the same as specified in Chapter 115, RSMo.  If necessary, election officials may limit the number of choices a voter may rank to three.  Write-in votes will still be allowed.
",,,http://house.mo.gov/content.aspx?info=/bills091/action/aHB463.htm,,
Corporate Tax Disclosure Requirements,2009 New Jersey Senate Bill 3153,,2009,New Jersey Legislature,http://www.njleg.state.nj.us/,New Jersey,Exemplary,State,Bill ,http://www.BrandeisProject.org/Alice/Web_Folder/Revenue_And_Budget/Corporate_Tax_Disclosure_Requirements/2009_New_Jersey_Senate_Bill_3153.pdf,,,The bill requires that the Governor's annual budget message include a State tax expenditure report. State governmental policy objectives are sought to be achieved by both the granting of direct expenditures of governmental funds and by the granting of special and selective tax relief or tax expenditures. Both direct expenditures of governmental funds and tax expenditures affect the ability of the State government to set tax rates and collect State tax revenue andimplement the functions of government through the expenditure of governmental funds. The Legislature's review of the Governor's annual budget messages examines the fiscal soundness and effectiveness of proposed State spending decisions.,,,,,
Efficient Location of Public Buildings,2009 Maryland Executive Order 01.01.2009.12 ,,2009,Maryland,www.governor.maryland.gov,Maryland,Exemplary ,State,Executive Order,http://www.BrandeisProject.org/Alice/Web_Folder/Infrastructure_and_Smart_Growth/Efficient_Location_of_Public_Buildings/2009_Maryland_Executive_Order_01.01.2009.12.pdf,,,An order that state government offices will be located within a half-mile of transit stations in order to facilitate tramsit orientated development in the state,,,,"Public Transportation, Government Performance",
Municipal Identification Cards,2009 New York Ordinance City 602,,2009,New York City Council,http://council.nyc.gov/html/home/home.shtml,New York,Exemplary,Municipal,Act/Ordinance,http://www.BrandeisProject.org/Alice/Web_Folder/Immigrant_Rights/Municipal_Identification_Cards/2009_New_York_Ordinance_602.pdf,,,This ordinance creates a municipal identification card and mandates that proof of city residence for the identification card application shall not include an applicant's national immigration or citizenship status nor shall it require an applicant to provide a social security or tax identification number.,,,http://legistar.council.nyc.gov/LegislationDetail.aspx?ID=451478&GUID=B93A2774-B031-4996-BBC8-65B5D7225CDB&Search=&Options=,,
Energy Audits and Retrocommissioning,2009 New York City Initiative Number 967-A,,2009, New York City Council ,http://council.nyc.gov/html/home/home.shtml,New York ,Exemplary,Municipal ,Act/Ordinance,http://www.BrandeisProject.org/Alice/Web_Folder/Energy_and_Environment/Energy_Audits_and_Retrocommissioning/2009_New_York_City_Intitiative_Number_967_A.pdf,,,"A Local Law to amend the New York city charter and the administrative code of the city of New York, in relation to requiring energy audits and retro-commissioning of base building systems of certain buildings and retro-fitting of certain city-owned buildings.",,,http://legistar.council.nyc.gov/LegislationDetail.aspx?ID=452543&GUID=AF748A00-A263-4200-A91E-316346690D2A,,
Feed-in-Tariff,2009 City of Gainesville Ordinance No. 0-08-88,,2009,Gainesville City Council ,http://www.gainesville.org/city-council,Florida,Exemplary,Municipal ,Act/Ordinance,http://www.BrandeisProject.org/Alice/Web_Folder/Energy_and_Environment/Feed-in-Tariff/2009_City_of_Gainesville_Ordinance_No_0_08_88.pdf,,,This ordinance adds provisions for the purchase of solacer generated energy through a standard offer contract for all classes. ,,,,,
Lighting and Submeters,2009 New York City Initiative Number 973-A,,2009, New York City Council ,http://council.nyc.gov/html/home/home.shtml,New York ,Exemplary,Municipal ,Act/Ordinance,http://www.BrandeisProject.org/Alice/Web_Folder/Energy_and_Environment/Lighting_and_Submeters/2009_New_York_City_Int_No_973_A.pdf,,,"A Local Law to amend the administrative code of the city of New York, in relation to upgrading lighting systems and the installation of sub-meters in certain buildings.",,,http://legistar.council.nyc.gov/LegislationDetail.aspx?ID=452544&GUID=6D5AC831-E5AD-4A26-B6CC-C46E6ED946FC,,
Storm Water Management,2009 West Deer Stormwater Ordinance ,,2009,Township of West Deer,http://www.westdeertownship.com/,Pennsylvania ,Exemplary,Municipal ,Act/Ordinance,http://www.BrandeisProject.org/Alice/Web_Folder/Energy_and_Environment/Storm_Water_Management/2009_West_Deer_Stormwater_Ordinance.pdf,,,An ordinance relating to stormwater management ,,,,,
Local Purchasing Preferences,"Local Purchasing Preference-Madison, Wisconsin",,2009,Institute for Local Self Reliance,http://www.ilsr.org/,Wisconsin,Support,Municipal,Other,http://www.BrandeisProject.org/Alice/Web_Folder/Government_Performance/Local_Purchasing_Preferences/Local_Purchasing_Preference_Madison_Wisconsin.pdf,,,"Summary of Madison, Wisconsin's Local Preference Purchasing Policy",,,,"Small Business, Local Procurement, Local Business, Government Procurement, Government Contracting,",
Complete Streets,North Carolina Complete Streets Policy,,2009,North Carolina Department of Transportation ,http://www.nccompletestreets.org/policy.asp,North Carolina,Support,State,Other,http://www.BrandeisProject.org/Alice/Web_Folder/Infrastructure_and_Smart_Growth/Complete_Streets/North_Carolina_Complete_Streets_Policy.pdf,,,"Complete Streets is North Carolina’s approach to interdependent, 
multi-modal transportation networks that safely accommodate access and 
travel for all users.",,,,"Public Transportation, Bike Policy, Urban Planning",
Divesting Government Funds from Banks that do not Cooperate with Foreclosure Prevention Efforts ,2009 Los Angeles City Council Motion,,2009,Los Angeles City Council,http://www.lacity.org/YourGovernment/CityCouncil/index.htm,California,Exemplary,Municipal,Other,http://www.BrandeisProject.org/Alice/Web_Folder/Economic_and_Workforce_Development/Divesting_Government_Funds_from_Banks_that_do_not_Cooperate_with_Foreclosure_Prevention_Efforts/2009_Los_Angeles_City_Council_Motion.pdf,,,"A motion requiring that municipal agencies report within thirty days on the potential divestiture of all deposits in banking and other financial institutions that fail to cooperate with foreclosure prevention efforts that include temporary moratoriums on foreclosures, renegotiation of mortgage principles to reflect current values, and good faith negotiations with mortgagees.",,,,"Foreclosure, ",
Early College High School Initiative,Innovations in College Readiness: How Early College Schools are Preparing Students Underrepresented in Higher Education for College Success ,,2009,Jobs for the Future,http://www.jff.org/,"California, Massachusetts, New York, Texas",Support,State,Report,http://www.BrandeisProject.org/Alice/Web_Folder/Education/Early_College_High_School_Initiative/2009_Innovations_in_College_Readiness.pdf,,,"Innovations in College Readiness describes a young national 
effort—the Early College High School Initiative—that in seven years has 
made headway in contesting those trends. The initiative has done so by 
focusing on the same challenge President Obama enunciated: getting more 
students prepared for and successfully completing postsecondary 
education",,,,"Dual Degree, College Credit Early College Education",
Teacher Development,A Teacher Development Continuum: The Role of Policy in Creatinga Supportive Pathway into the Profession,,2009,New Teacher Center,http://www.newteachercenter.org/,,Support,"State, Municipal",Report,http://www.BrandeisProject.org/Alice/Web_Folder/Education/Teacher_Development/2009_A_Teacher_Development_Continuum_The_Role_of_Policy.pdf,,,"As a growing number of experienced teachers begin to retire, supporting 
the cadre of new educators who will replace them to become more 
effective more quickly will be a primary goal of policy makers and 
educators in the coming years.  A report coming from a policy roundtable
 on pre-service/induction linkages in May 2008, this Policy Brief 
discusses how the learning curve of new teachers presents challenges to 
student achievement and provides a new vision for teacher development 
supported by a host of promising examples. ",,,,,
Broadening the Tax Base to Include Taxing Services,Expanding Sales Taxation of Services: Options and Issues,,2009,Center on Budget and Policy Priorities,http://www.cbpp.org/,,Support,State,Report,http://www.BrandeisProject.org/Alice/Web_Folder/Revenue_And_Budget/Broadening_the_Tax_Base_to_Include_Taxing_Services/Expanding_Sales_Taxation_of_Service_Options_and_Issues.pdf,,,"A report on the benefits of expanding state sales tax to including taxing services in addition to goods. Levying sales taxes on services makes state tax systems fairer, 
more stable, more economically neutral, and easier to administer.  Moreover, because state sales 
taxes are a major source of funding for schools, universities, health care, public safety, and other 
functions of state and local government, adding services to state sales tax bases can help states 
maintain their support for those functions, for instance during an economic downturn when state 
revenues are declining. ",,,,,
Combined Reporting,Combined Reporting: How Closing Corporate Loopholes Benefits Wisconsin,,2009,Institute for Wisconsin's Future,http://www.wisconsinsfuture.org/,Wisconsin,Support,State,Report,http://www.BrandeisProject.org/Alice/Web_Folder/Revenue_And_Budget/Combined_Reporting/Combined_Reporting_How_Closing_Corporate_Loopholes_Benefits_Wisconsin.pdf,,,"A report on how combined reporting closes 
tax law loopholes that allow very large multi-state corporations to shift profits out of Wisconsin in order to 
minimize or avoid paying state income tax. The report looks at how combined reporting affects the state economy, business competitiveness and employment.",,,,,
Minimum Wage Increase and Index,Fix It and Forget It: Index the Minimum Wage to Growth in Average Wages,,2009,Economic Policy Institute,http://www.epi.org/,,Support,State,Report,http://www.BrandeisProject.org/Alice/Web_Folder/Labor_Rights_and_Protections/Minimum_Wage-Increase_and_Index/Fix_it_and_Forget_it.pdf,,,"Report on how raising and indexing the minimum wage benefits workers, employers and the economy",,,,"Prevailing Wage, Minimum Wage, Wage Index, Workforce Development,",
